{"$schema":"https://json-schema.org/draft/2020-12/schema","title":"Experiment Contract v1","type":"object","additionalProperties":false,"required":["experiment_id","anchor","instrument","anchor_time_rule","exposure_class","native_scale_scope","eligible_context","population","measurements_and_outcomes","controls","development_data_scope","confirmation_data_scope","discovery_status","normalization_basis","created_utc"],"properties":{"experiment_id":{"type":"string"},"anchor":{"type":"object","additionalProperties":false,"required":["detector_id","lifecycle_state","anchor_time_semantics"],"properties":{"detector_id":{"type":"string"},"lifecycle_state":{"type":"string"},"anchor_time_semantics":{"type":"string"}}},"instrument":{"type":"string"},"anchor_time_rule":{"type":"object","additionalProperties":false,"required":["source","semantics"],"properties":{"source":{"type":"string"},"semantics":{"type":"string"}}},"exposure_class":{"enum":["E1","E2","E3"]},"native_scale_scope":{"oneOf":[{"type":"object","required":["kind"],"properties":{"kind":{"const":"tick"}}},{"type":"object","required":["kind","scales"],"properties":{"kind":{"const":"explicit"},"scales":{"type":"array","items":{"enum":["15s","30s","1m","5m","15m","1h","4h"]}}}},{"type":"object","required":["kind"],"properties":{"kind":{"const":"all_registered"}}}]},"eligible_context":{"type":"object","additionalProperties":false,"required":["allowed_detectors","requested_detectors"],"properties":{"allowed_detectors":{"type":"array","items":{"type":"string"}},"requested_detectors":{"type":"array","items":{"type":"string"}}}},"population":{},"measurements_and_outcomes":{},"controls":{},"development_data_scope":{},"confirmation_data_scope":{},"discovery_status":{"enum":["predeclared","discovered"]},"normalization_basis":{"type":"string"},"created_utc":{"type":"string"}}}
