{"experiment_id":"AE-001","anchor":{"detector_id":"fvg","lifecycle_state":"formed","anchor_time_semantics":"known_at_anchor"},"instrument":"XAUUSD","anchor_time_rule":{"source":"known_time","semantics":"available_time <= anchor_time"},"exposure_class":"E3","native_scale_scope":{"kind":"explicit","scales":["15m","1h"]},"eligible_context":{"allowed_detectors":["range","time_context"],"requested_detectors":["range"]},"population":"all authoritative anchor instances in the declared period","measurements_and_outcomes":{"raw":["native_measurement"],"normalized":["normalized_measurement"]},"controls":{"kind":"declared_null_control"},"development_data_scope":{"start":"2020-01-01","end":"2024-12-31"},"confirmation_data_scope":{"start":"2025-01-01","end":"2025-12-31"},"discovery_status":"predeclared","normalization_basis":"native detector basis, preserved with each result","created_utc":"2026-09-03T00:00:00Z"}
